{
  "source": "Natural Earth 10m Admin 1 - States, Provinces (Argentina subset)",
  "source_url": "https://github.com/nvkelso/natural-earth-vector/blob/master/geojson/ne_10m_admin_1_states_provinces.geojson",
  "retrieved_at": "2026-10-04",
  "license_or_terms": "Public domain (Natural Earth)",
  "attribution": "Made with Natural Earth. Free vector and raster map data at naturalearthdata.com (public domain).",
  "input_sha256": "e019ae1986d3c99c774d81436ffaa616b82d59309d60525eea64444c89af3751",
  "simplification": {
    "algorithm": "visvalingam-whyatt (topojson-simplify, planar triangle area in square degrees)",
    "parameter": 0.0000775785193382623,
    "vertices_before": 10735,
    "vertices_after": 6447,
    "bytes": 119992
  },
  "dropped_polygons": [],
  "area_change_pct": {
    "AR-A": 0.002919,
    "AR-B": 0.000546,
    "AR-C": 0.310893,
    "AR-D": 0.008196,
    "AR-E": 0.000589,
    "AR-F": 0.00974,
    "AR-G": 0.00362,
    "AR-H": 0.007514,
    "AR-J": 0.000695,
    "AR-K": 0.010245,
    "AR-L": 0.000402,
    "AR-M": 0.000468,
    "AR-N": 0.010013,
    "AR-P": 0.00161,
    "AR-Q": 0.005036,
    "AR-R": 0.002934,
    "AR-S": 0.002583,
    "AR-T": 0.020008,
    "AR-U": 0.002932,
    "AR-V": 0.015275,
    "AR-W": 0.000992,
    "AR-X": 0.00207,
    "AR-Y": 0.003117,
    "AR-Z": 0.005199
  },
  "provinces_count": 24,
  "generated_by": "web/scripts/geo"
}
